{
  "$schema": "https://json-schema.org/draft/2020-12/schema",
  "$id": "https://github.com/JohnAndrewBalbarosa/NeoTerritory/scripts/deploy-manifest.schema.json",
  "title": "NeoTerritory Deploy Manifest",
  "description": "Declarative source of truth for what gets shipped to the AWS Lightsail host during `scripts/deploy-aws.sh`. Consumed by `ops/bash/deploy/lib/ship.sh`. Schema mirrors the package.json convention so the manifest is parseable, diffable, and obvious to maintainers.",
  "type": "object",
  "required": ["version", "remote", "includes", "excludes"],
  "additionalProperties": true,
  "properties": {
    "$schema":      { "type": "string" },
    "version":      { "type": "integer", "minimum": 1 },
    "_description": { "type": "string", "description": "Free-form human note; ignored by the parser." },

    "remote": {
      "type": "object",
      "required": ["appDir", "binary", "port", "healthPath"],
      "additionalProperties": false,
      "properties": {
        "appDir":     { "type": "string", "description": "Absolute path on the remote host where the source tree is extracted." },
        "binary":     { "type": "string", "description": "Path (relative to appDir) of the compiled microservice binary the backend invokes." },
        "port":       { "type": "integer", "minimum": 1, "maximum": 65535 },
        "healthPath": { "type": "string", "pattern": "^/" }
      }
    },

    "includes": {
      "type": "array",
      "items": { "type": "string", "description": "Path relative to the repo root that gets tarred and shipped." },
      "minItems": 1,
      "uniqueItems": true
    },

    "excludes": {
      "type": "array",
      "items": { "type": "string", "description": "Glob (tar --exclude syntax) that is dropped from the ship archive." },
      "uniqueItems": true
    }
  }
}
